{
  "$schema": "https://json-schema.org/draft/2020-12/schema",
  "title": "calendar_events.json",
  "type": "array",
  "items": {
    "type": "object",
    "required": ["calendar", "title", "start", "end"],
    "properties": {
      "event_id": { "type": "string" },
      "task_id": { "type": "string" },
      "aliases": { "type": "array", "items": { "type": "string" } },
      "calendar": { "type": "string" },
      "title": { "type": "string" },
      "start": { "type": "string" },
      "end": { "type": "string" },
      "isAllDay": { "type": "boolean" }
    },
    "additionalProperties": true
  }
}
