[
  {"calendar": "Research", "title": "Cell bank recovery check", "start": "2026-03-10T09:30:00+08:00", "end": "2026-03-10T10:00:00+08:00", "isAllDay": false},
  {"calendar": "Research", "title": "Reagent inventory review", "start": "2026-03-10T14:00:00+08:00", "end": "2026-03-10T14:45:00+08:00", "isAllDay": false},
  {"calendar": "Research", "title": "Passage adherent cells for assay pilot", "start": "2026-03-11T10:00:00+08:00", "end": "2026-03-11T10:50:00+08:00", "isAllDay": false},
  {"calendar": "Team", "title": "Weekly operations meeting", "start": "2026-03-11T15:30:00+08:00", "end": "2026-03-11T16:30:00+08:00", "isAllDay": false},
  {"calendar": "Research", "title": "Prepare DLS samples", "start": "2026-03-12T09:45:00+08:00", "end": "2026-03-12T10:30:00+08:00", "isAllDay": false},
  {"calendar": "Research", "title": "DLS readout", "start": "2026-03-12T13:30:00+08:00", "end": "2026-03-12T14:30:00+08:00", "isAllDay": false},
  {"calendar": "Research", "title": "Format RNA summary slides", "start": "2026-03-13T09:30:00+08:00", "end": "2026-03-13T11:00:00+08:00", "isAllDay": false},
  {"calendar": "Team", "title": "Friday lab meeting", "start": "2026-03-13T15:30:00+08:00", "end": "2026-03-13T17:30:00+08:00", "isAllDay": false},
  {"calendar": "Research", "title": "Seed 3D spheroid plates", "start": "2026-03-15T13:30:00+08:00", "end": "2026-03-15T14:30:00+08:00", "isAllDay": false},
  {"calendar": "Research", "title": "Passage anchor culture for expansion", "start": "2026-03-15T15:30:00+08:00", "end": "2026-03-15T16:15:00+08:00", "isAllDay": false},
  {"calendar": "Research", "title": "Expand GFP reporter culture 5 flasks to 10 flasks", "start": "2026-03-15T16:30:00+08:00", "end": "2026-03-15T17:45:00+08:00", "isAllDay": false},
  {"calendar": "Research", "title": "Run 0h surface labeling flow panel", "start": "2026-03-16T08:30:00+08:00", "end": "2026-03-16T09:15:00+08:00", "isAllDay": false},
  {"calendar": "Research", "title": "Start uptake assay with dye particle panel", "start": "2026-03-16T09:30:00+08:00", "end": "2026-03-16T10:30:00+08:00", "isAllDay": false},
  {"calendar": "Research", "title": "Update RNA slide deck and figures", "start": "2026-03-16T11:00:00+08:00", "end": "2026-03-16T12:15:00+08:00", "isAllDay": false},
  {"calendar": "Research", "title": "Check spheroid morphology day 1", "start": "2026-03-16T15:00:00+08:00", "end": "2026-03-16T15:20:00+08:00", "isAllDay": false},
  {"calendar": "Research", "title": "Confirm animal cohort arrival and cage assignment", "start": "2026-03-16T17:00:00+08:00", "end": "2026-03-16T17:30:00+08:00", "isAllDay": false},
  {"calendar": "Research", "title": "Run 24h flow timepoint", "start": "2026-03-17T09:30:00+08:00", "end": "2026-03-17T10:30:00+08:00", "isAllDay": false},
  {"calendar": "Research", "title": "If reporter culture is ready: expand to 20 flasks and seed spheroids", "start": "2026-03-17T15:00:00+08:00", "end": "2026-03-17T16:00:00+08:00", "isAllDay": false},
  {"calendar": "Research", "title": "Check spheroid morphology day 2", "start": "2026-03-18T10:45:00+08:00", "end": "2026-03-18T11:05:00+08:00", "isAllDay": false},
  {"calendar": "Research", "title": "If spheroids are compact: embed in matrix", "start": "2026-03-18T12:30:00+08:00", "end": "2026-03-18T13:00:00+08:00", "isAllDay": false},
  {"calendar": "Research", "title": "Zeta potential measurement", "start": "2026-03-19T13:30:00+08:00", "end": "2026-03-19T14:00:00+08:00", "isAllDay": false},
  {"calendar": "Research", "title": "Run 48h flow timepoint", "start": "2026-03-20T09:30:00+08:00", "end": "2026-03-20T10:30:00+08:00", "isAllDay": false},
  {"calendar": "Team", "title": "Friday lab meeting", "start": "2026-03-20T15:30:00+08:00", "end": "2026-03-20T17:30:00+08:00", "isAllDay": false},
  {"calendar": "Research", "title": "In vivo cohort preparation window", "start": "2026-03-23T10:00:00+08:00", "end": "2026-03-23T11:00:00+08:00", "isAllDay": false},
  {"calendar": "Research", "title": "If cells and mice are ready: cohort start", "start": "2026-03-23T14:00:00+08:00", "end": "2026-03-23T16:30:00+08:00", "isAllDay": false}
]
